{
  "$schema": "docs/capabilities.schema.json",
  "schemaVersion": 1,
  "mode": "skeleton",
  "name": "kotlin-skeleton",
  "summary": "Kotlin + Spring Boot 백엔드 스켈레톤 — 새 프로젝트가 필요한 모듈만 골라 한 줄로 찍어 가는 부품 모음(모듈 하나 = 의존성 한 줄). 프런트는 형제 레포 react-skeleton.",
  "siblings": {
    "frontend": {
      "repo": "react-skeleton",
      "catalog": "capabilities.json",
      "llms": "llms.txt",
      "recipe": "docs/new-project-recipe.md",
      "usage": "scripts/new-project.sh <target-dir> <name> [--packages a,b,c] [--ssr] [--without-storybook] [--with-workbench] [--with-sample] [--scope @acme]"
    }
  },
  "starterModules": [
    "account",
    "account-jdbc",
    "alert",
    "auth",
    "auth-session",
    "auth-session-jdbc",
    "auth-social",
    "captcha-turnstile",
    "db-postgresql",
    "idempotency",
    "job-queue-jdbc",
    "legal",
    "legal-jdbc",
    "migration",
    "migration-flyway",
    "notification-mail",
    "persistence-jdbc",
    "platform",
    "time"
  ],
  "newProject": {
    "script": "scripts/new-project.sh",
    "usage": "scripts/new-project.sh <target-dir> <root-package> <config-prefix> <ClassPrefix> [--modules a,b,c] [--db postgresql|mysql] [--with-workbench] [--with-sample] [--dry-run]",
    "positional": ["target-dir", "root-package", "config-prefix", "ClassPrefix"],
    "flags": ["--modules", "--db", "--with-workbench", "--with-sample", "--dry-run"]
  },
  "guides": [
    {
      "path": "docs/new-project-recipe.md",
      "summary": "제품 한 문단 → 고를 것 → new-project.sh 명령 → 설정 · 비밀 → scripts/dev.sh → 검증 → deploy/app.yaml, 작업 예 3개(커뮤니티 · 유료 SaaS · 콘텐츠 SSR)"
    },
    {
      "path": "docs/minimal-composition.md",
      "summary": "스타터에서 모듈 한 줄씩 더하는 법 · 모듈별 「부팅에 필요한 것」 표 · new-project.sh 가 하는 일"
    },
    {
      "path": "docs/modules/README.md",
      "summary": "모듈 색인 — 모듈마다 같은 틀의 한 쪽 문서(의존성 한 줄 · 설정 접두사 · 부팅에 필요한 것 · 교체 지점 · 프런트 짝)"
    },
    {
      "path": "docs/deploy.md",
      "summary": "홈서버 배포 계약 — 이미지 하나 + deploy/app.yaml 선언, 모듈별 비밀과 빠졌을 때의 동작(§7)"
    },
    {
      "path": "README.md",
      "summary": "레포 개요 · 새 프로젝트 3단계"
    },
    {
      "path": "CLAUDE.md",
      "summary": "에이전트 규칙(모듈 규칙 · 문서 가드 · 패키지 구조)"
    }
  ],
  "capabilities": [
    {
      "id": "account",
      "kind": "module",
      "module": "account",
      "path": "modules/account",
      "status": "experimental",
      "summary": "계정 수명주기 — 이메일 · 비밀번호 가입과 이메일 확인, 비밀번호 재설정 · 변경, 이메일 변경, 소셜 연결(자동 병합 없음), 탈퇴(다시 인증 → 유예 → 개인정보만 지우고 행은 ERASED 로 남김, 탈퇴 취소, 정지는 박제 + 해시 재가입 차단), 닉네임(중복 허용 · 유일 · 꼬리표 `닉네임#0417` 방식 · 필수 · 자동 닉네임 · 예약어, 작성자 이름 조회 AuthorDirectory 기본 구현), 로그인 시도 제한, 관리자 도구, 첫 관리자, ko/en 메일 템플릿. auth 가 진짜 계정으로 로그인하게 한다.",
      "starter": true,
      "newProjectFlag": null,
      "autoIncludes": [],
      "needs": {
        "requires": [],
        "oneOf": [],
        "optional": ["alert", "auth-social", "captcha-turnstile", "idempotency", "job-queue-jdbc", "notification-mail"]
      },
      "config": {
        "prefixes": ["skeleton.account"],
        "snippet": "docs/config/modules/account.yml"
      },
      "basePaths": [
        "/api/v1",
        "/api/v1/account",
        "/api/v1/account/identities/social",
        "/api/v1/admin/accounts",
        "/api/v1/auth"
      ],
      "secrets": [
        {
          "env": ["<P>_ACCOUNT_MAIL_LINK_BASE_URL"],
          "whenMissing": "메일 링크가 여는 프론트 주소 — 비밀 아님(선언의 env:). 비면 보호 환경(<P>_ENV=stage|prod)에서 기동 실패"
        },
        {
          "env": ["<P>_ACCOUNT_BOOTSTRAP_ADMIN_EMAIL"],
          "whenMissing": "선택 — 이 이메일이 확인되면 ADMIN 을 준다. 없으면 관리자 API 를 켠 앱은 경고"
        },
        {
          "env": ["<P>_ACCOUNT_BLOCKS_SECRET"],
          "whenMissing": "재가입 차단 해시(HMAC)의 키 — 선언의 secrets: (무작위로 충분). 관리자 API 를 켠 앱만 필요하고 비면 JWT 비밀에서 파생돼 경고만 난다(JWT 비밀을 돌리면 차단이 풀린다)"
        },
        {
          "env": ["<P>_CLIENT_IP_MODE", "<P>_CLIENT_IP_TRUSTED_PROXIES"],
          "whenMissing": "홈서버 플랫폼이 넣는다(예약 이름). 안 정해지면 보호 환경에서 기동 실패 — IP 한도가 X-Forwarded-For 로 풀린다",
          "platformProvided": true
        }
      ],
      "docs": ["docs/modules/account.md"],
      "frontend": {
        "capabilities": ["auth", "account-lifecycle", "account-admin"],
        "newProjectFlag": null,
        "packages": ["@skeleton/auth"]
      },
      "notFor": [
        "메일 발송 자체는 notification-mail — 보호 환경에서는 메일 발송 길(notification-mail 또는 AccountMailTransport 빈)이 없으면 기동을 거부한다",
        "소셜 제공자 클라이언트는 auth-social-google | -kakao | -naver",
        "리프레시 토큰 · 세션 목록은 auth-session, 링크 로그인은 auth-magic-link",
        "소셜 로그인을 계정으로 이어 주는 것은 켜진 auth-social 과 skeleton.account.social.* 설정(모듈 기본은 가입 · 병합 모두 꺼짐)"
      ],
      "keywords": {
        "ko": [
          "회원가입",
          "가입",
          "이메일 인증",
          "비밀번호 재설정",
          "비밀번호 찾기",
          "이메일 변경",
          "계정 삭제",
          "탈퇴",
          "계정 관리",
          "관리자 도구",
          "계정 정지",
          "프로필"
        ],
        "en": [
          "sign up",
          "registration",
          "email verification",
          "password reset",
          "forgot password",
          "change email",
          "delete account",
          "account management",
          "admin tools",
          "suspend account",
          "profile"
        ]
      }
    },
    {
      "id": "account-jdbc",
      "kind": "module",
      "module": "account-jdbc",
      "path": "modules/account-jdbc",
      "status": "experimental",
      "summary": "account 의 저장소 · 토큰 · 감사 기록을 PostgreSQL · MySQL 로 — 스키마는 모듈 마이그레이션(MySQL 은 이메일 · 닉네임 키를 utf8mb4_bin 으로 정확 일치, 닉네임 방식 셋을 유니크 (키, 꼬리표) 하나로). 보호 환경에서 메모리 저장소를 막는 가드를 통과하는 방법.",
      "starter": true,
      "newProjectFlag": null,
      "autoIncludes": [],
      "needs": {
        "requires": [],
        "oneOf": [],
        "optional": []
      },
      "config": null,
      "basePaths": [],
      "secrets": [],
      "docs": ["docs/modules/account-jdbc.md"],
      "frontend": {
        "capabilities": ["account-lifecycle"],
        "newProjectFlag": null,
        "packages": ["@skeleton/auth"]
      },
      "notFor": [
        "account 없이 단독으로는 의미가 없다 — account 의 포트 구현이다",
        "다른 DB 는 AccountRepository · OneTimeTokenStore 를 앱이 직접 구현한다"
      ],
      "keywords": {
        "ko": ["계정 저장", "계정 DB", "회원 테이블", "계정 마이그레이션"],
        "en": ["account storage", "accounts table", "account persistence", "account migration"]
      }
    },
    {
      "id": "alert",
      "kind": "module",
      "module": "alert",
      "path": "modules/alert",
      "status": "stable",
      "summary": "주인 경보 — 5xx 몰림 · 기동 실패 · 죽은 작업을 Discord 호환 웹훅(+ 선택적 메일)으로 알린다. 에러 수집(Sentry)의 답.",
      "starter": true,
      "newProjectFlag": null,
      "autoIncludes": ["job-queue-jdbc", "notification-mail"],
      "needs": {
        "requires": [],
        "oneOf": [],
        "optional": ["job-queue-jdbc", "notification-mail"]
      },
      "config": {
        "prefixes": ["skeleton.alert"],
        "snippet": "docs/config/modules/alert.yml"
      },
      "basePaths": [],
      "secrets": [
        {
          "env": ["<P>_ALERT_WEBHOOK_URL"],
          "whenMissing": "경보가 로그로만 남는다 (기동은 된다)"
        }
      ],
      "docs": ["docs/modules/alert.md", "docs/alert.md"],
      "frontend": null,
      "notFor": [
        "Sentry 같은 에러 수집 · 스택 모음이 아니다 — 주인이 먼저 알아야 하는 일만 보낸다",
        "사용자에게 가는 알림은 notification",
        "웹훅 주소가 없으면 로그만 남긴다(기동은 된다)"
      ],
      "keywords": {
        "ko": ["경보", "주인 알림", "에러 알림", "장애 알림", "디스코드 알림", "에러 수집", "5xx 알림"],
        "en": [
          "owner alert",
          "error reporting",
          "discord webhook",
          "incident alert",
          "5xx alert",
          "sentry alternative"
        ]
      }
    },
    {
      "id": "alert-jdbc",
      "kind": "module",
      "module": "alert-jdbc",
      "path": "modules/alert-jdbc",
      "status": "stable",
      "summary": "경보 기록을 DB 에 두어 여러 인스턴스 · 재시작을 가로질러 같은 경보를 접는다 (PostgreSQL · MySQL).",
      "starter": false,
      "newProjectFlag": "--modules alert-jdbc",
      "autoIncludes": [],
      "needs": {
        "requires": [],
        "oneOf": [],
        "optional": []
      },
      "config": {
        "prefixes": ["skeleton.alert-jdbc"],
        "snippet": "docs/config/modules/alert-jdbc.yml"
      },
      "basePaths": [],
      "secrets": [],
      "docs": ["docs/modules/alert-jdbc.md"],
      "frontend": null,
      "notFor": ["단일 인스턴스면 alert 의 메모리 저장소로 충분하다", "DataSource · db-* 모듈과 이 모듈의 마이그레이션이 적용된 스키마가 필요하다"],
      "keywords": {
        "ko": ["경보 기록", "경보 중복 접기", "경보 DB"],
        "en": ["alert ledger", "alert dedupe", "alert database"]
      }
    },
    {
      "id": "async",
      "kind": "module",
      "module": "async",
      "path": "modules/async",
      "status": "stable",
      "summary": "@Async · CompletableFuture 작업이 호출 스레드의 trace id · MDC · 보안 컨텍스트를 이어받는 실행기와 작업 그룹.",
      "starter": false,
      "newProjectFlag": "--modules async",
      "autoIncludes": [],
      "needs": {
        "requires": [],
        "oneOf": [],
        "optional": []
      },
      "config": {
        "prefixes": ["skeleton.async"],
        "snippet": "docs/config/modules/async.yml"
      },
      "basePaths": [],
      "secrets": [],
      "docs": ["docs/modules/async.md", "docs/async.md"],
      "frontend": null,
      "notFor": ["재시도 · 영속이 필요한 작업은 job-queue-jdbc — 이 모듈은 프로세스 안 실행기다"],
      "keywords": {
        "ko": ["비동기", "백그라운드 작업", "스레드 풀", "@Async", "작업 그룹"],
        "en": ["async", "background task", "thread pool", "mdc propagation", "completable future"]
      }
    },
    {
      "id": "async-notification",
      "kind": "module",
      "module": "async-notification",
      "path": "modules/async-notification",
      "status": "stable",
      "summary": "비동기 작업에서 처리되지 않은 예외를 알림(notification)으로 흘려 보낸다.",
      "starter": false,
      "newProjectFlag": "--modules async-notification",
      "autoIncludes": ["async", "notification"],
      "needs": {
        "requires": [],
        "oneOf": [],
        "optional": []
      },